judul,narasi,clear,token_komen,freq_words,stemmed_komen,polarity_score,polarity,score
Foto Helikopter-Tank Pertama di Dunia Buatan Turki dan Pakistan,Foto Helikopter-Tank Pertama di Dunia Buatan Turki dan Pakistan,foto helikoptertank pertama dunia buatan turki pakistan,"['foto', 'helikoptertank', 'pertama', 'dunia', 'buatan', 'turki', 'pakistan']",<FreqDist with 7 samples and 7 outcomes>,"['foto', 'helikoptertank', 'pertama', 'dunia', 'buat', 'turki', 'pakistan']",5,positive,1
Es Krim Merek AICE Bosnya Orang Cina dan Bahannya Kimia Semua,"Siang tadi sy mampir di distributor es krim merk _*Aice*_ yg sedang marak penetrasi bisnisnya yg terletak di selatan tugu lilin makam haji, melihat banyak spanduk bertulisan china iseng2 sy tanya penjaga counter yg didepan pinggir jln, bos nya orang mana mba jakarta atau solo, dijawab : “orang china”, lho kok tau kalau org china apa sdh pernah ketemu? Tris dia nunjuk disebuah mobil avanza putih, itu bosnya di dlm mobil itu, ngomongnya aja pake bhs china , dia asli datang dari china ..katanya. Penasaran sy tunggu si bos keluar dari mobil, betul ternyata chino!!",siang tadi sy mampir distributor es krim merk aice sedang marak penetrasi bisnisnya terletak selatan tugu lilin makam haji melihat banyak spanduk bertulisan iseng sy tanya penjaga counter didepan pinggir jln bos orang mana mba jakarta solo dijawab “ orang china ” lho kok tau kalau org apa sdh pernah ketemu tris nunjuk disebuah mobil avanza putih bosnya dlm mobil ngomongnya aja pake bhs asli datang china katanya penasaran sy tunggu si bos keluar mobil betul ternyata chino,"['siang', 'tadi', 'sy', 'mampir', 'distributor', 'es', 'krim', 'merk', 'aice', 'sedang', 'marak', 'penetrasi', 'bisnisnya', 'terletak', 'selatan', 'tugu', 'lilin', 'makam', 'haji', 'melihat', 'banyak', 'spanduk', 'bertulisan', 'iseng', 'sy', 'tanya', 'penjaga', 'counter', 'didepan', 'pinggir', 'jln', 'bos', 'orang', 'mana', 'mba', 'jakarta', 'solo', 'dijawab', '“', 'orang', 'china', '”', 'lho', 'kok', 'tau', 'kalau', 'org', 'apa', 'sdh', 'pernah', 'ketemu', 'tris', 'nunjuk', 'disebuah', 'mobil', 'avanza', 'putih', 'bosnya', 'dlm', 'mobil', 'ngomongnya', 'aja', 'pake', 'bhs', 'asli', 'datang', 'china', 'katanya', 'penasaran', 'sy', 'tunggu', 'si', 'bos', 'keluar', 'mobil', 'betul', 'ternyata', 'chino']",<FreqDist with 71 samples and 78 outcomes>,"['siang', 'tadi', 'sy', 'mampir', 'distributor', 'es', 'krim', 'merk', 'aice', 'sedang', 'marak', 'penetrasi', 'bisnis', 'letak', 'selatan', 'tugu', 'lilin', 'makam', 'haji', 'lihat', 'banyak', 'spanduk', 'tulis', 'iseng', 'sy', 'tanya', 'jaga', 'counter', 'depan', 'pinggir', 'jln', 'bos', 'orang', 'mana', 'mba', 'jakarta', 'solo', 'jawab', '', 'orang', 'china', '', 'lho', 'kok', 'tau', 'kalau', 'org', 'apa', 'sdh', 'pernah', 'ketemu', 'tris', 'nunjuk', 'buah', 'mobil', 'avanza', 'putih', 'bos', 'dlm', 'mobil', 'ngomongnya', 'aja', 'pake', 'bhs', 'asli', 'datang', 'china', 'kata', 'penasaran', 'sy', 'tunggu', 'si', 'bos', 'keluar', 'mobil', 'betul', 'nyata', 'chino']",-15,negative,-1
Video yang menunjukkan anak Muslim yang disiksa oleh Budha di Myanmar,Video yang menunjukkan anak ‘Muslim’ yang disiksa oleh ‘Budha’ di Myanmar,video menunjukkan anak ‘ muslim ’ disiksa ‘ budha ’ myanmar,"['video', 'menunjukkan', 'anak', '‘', 'muslim', '’', 'disiksa', '‘', 'budha', '’', 'myanmar']",<FreqDist with 9 samples and 11 outcomes>,"['video', 'tunjuk', 'anak', '', 'muslim', '', 'siksa', '', 'budha', '', 'myanmar']",-3,negative,-1
Foto Kerusuhan Demo Anti Trump di Amerika Serikat,Foto Kerusuhan Demo Anti Trump di Amerika Serikat,foto kerusuhan demo anti trump amerika serikat,"['foto', 'kerusuhan', 'demo', 'anti', 'trump', 'amerika', 'serikat']",<FreqDist with 7 samples and 7 outcomes>,"['foto', 'rusuh', 'demo', 'anti', 'trump', 'amerika', 'serikat']",-7,negative,-1
"bentrok antar ormas Gerakan Jaga Indonesia dengan FPI, LPI dan HTI di Kota Bandung pada 27 Juli 2020","Aksi demo yang tanpa tujuan di depan Gedung DPR-MPR yang di lakukan 50 orang simpatisan PDI-P di komandoi oleh Boedi Djarot dkk, yang menginjak-injak, merobek, dan membakar Poster Habib Rizieq Syihab, ternyata berbuntut panjang. Di kota bandung terjadi Bentrok antara Ormas Gerakan Jaga Indonesia ( GJI-PDI-P ) dengan Ormas-ormas Islam FPI, HTI, LPI, pembela dan penjaga Pancasila, Nkri dan Ulama. Akibatnya 7 orang anggota ormasa Gerakan Jaga Indonesia & PDI-P mati kena sabetan pedang Lasykar FPI, dari pihak HTI 1 orang mengalami luka sabetan di bahu. Bukan itu saja Bentrokan pun meluas hingga terjadi Kebakaran beberapa pertokoan yang berdekatan dengan Markas PDI-P, karena lemparan Bom Molotov. Aparat Polisi pun tidak berani ke Tkp",aksi demo tanpa tujuan depan gedung dprmpr lakukan orang simpatisan pdip komandoi boedi djarot dkk menginjakinjak merobek membakar poster habib rizieq syihab ternyata berbuntut panjang kota bandung terjadi bentrok ormas gerakan jaga indonesia gjipdip ormasormas islam fpi hti lpi pembela penjaga pancasila nkri ulama akibatnya orang anggota ormasa gerakan jaga indonesia pdip mati kena sabetan pedang lasykar fpi pihak hti orang mengalami luka sabetan di bahu bukan saja bentrokan meluas hingga terjadi kebakaran beberapa pertokoan berdekatan markas pdip lemparan bom molotov aparat polisi tidak berani tkp,"['aksi', 'demo', 'tanpa', 'tujuan', 'depan', 'gedung', 'dprmpr', 'lakukan', 'orang', 'simpatisan', 'pdip', 'komandoi', 'boedi', 'djarot', 'dkk', 'menginjakinjak', 'merobek', 'membakar', 'poster', 'habib', 'rizieq', 'syihab', 'ternyata', 'berbuntut', 'panjang', 'kota', 'bandung', 'terjadi', 'bentrok', 'ormas', 'gerakan', 'jaga', 'indonesia', 'gjipdip', 'ormasormas', 'islam', 'fpi', 'hti', 'lpi', 'pembela', 'penjaga', 'pancasila', 'nkri', 'ulama', 'akibatnya', 'orang', 'anggota', 'ormasa', 'gerakan', 'jaga', 'indonesia', 'pdip', 'mati', 'kena', 'sabetan', 'pedang', 'lasykar', 'fpi', 'pihak', 'hti', 'orang', 'mengalami', 'luka', 'sabetan', 'di', 'bahu', 'bukan', 'saja', 'bentrokan', 'meluas', 'hingga', 'terjadi', 'kebakaran', 'beberapa', 'pertokoan', 'berdekatan', 'markas', 'pdip', 'lemparan', 'bom', 'molotov', 'aparat', 'polisi', 'tidak', 'berani', 'tkp']",<FreqDist with 75 samples and 86 outcomes>,"['aksi', 'demo', 'tanpa', 'tuju', 'depan', 'gedung', 'dprmpr', 'laku', 'orang', 'simpatisan', 'pdip', 'komando', 'boedi', 'djarot', 'dkk', 'menginjakinjak', 'robek', 'bakar', 'poster', 'habib', 'rizieq', 'syihab', 'nyata', 'buntut', 'panjang', 'kota', 'bandung', 'jadi', 'bentrok', 'ormas', 'gera', 'jaga', 'indonesia', 'gjipdip', 'ormasormas', 'islam', 'fpi', 'hti', 'lpi', 'bela', 'jaga', 'pancasila', 'nkri', 'ulama', 'akibat', 'orang', 'anggota', 'ormasa', 'gera', 'jaga', 'indonesia', 'pdip', 'mati', 'kena', 'sabet', 'pedang', 'lasykar', 'fpi', 'pihak', 'hti', 'orang', 'alami', 'luka', 'sabet', 'di', 'bahu', 'bukan', 'saja', 'bentrok', 'luas', 'hingga', 'jadi', 'bakar', 'beberapa', 'toko', 'dekat', 'markas', 'pdip', 'lempar', 'bom', 'molotov', 'aparat', 'polisi', 'tidak', 'berani', 'tkp']",-23,negative,-1
Video Kecelakaan Maut Di Air Terjun Uluk Til Belu NTT,Kecelakaan Maut Di Air Terjun Uluk Til Belu NTT,kecelakaan maut air terjun uluk til belu ntt,"['kecelakaan', 'maut', 'air', 'terjun', 'uluk', 'til', 'belu', 'ntt']",<FreqDist with 8 samples and 8 outcomes>,"['celaka', 'maut', 'air', 'terjun', 'uluk', 'til', 'belu', 'ntt']",-4,negative,-1
Aliran Komunis & Gerakan PKI Bangkit Lewat PDIP,"“Lebih jauh, Prijanto mengatakan, istilah petugas partai yang disampaikan Ketua Umum PDIP Megawati Soekarnoputri kepada Jokowi juga dinilai modus komunisme. Sebab, istilah petugas partai mirip dengan pekerja partai yang pernah dikatakan tokoh PKI DN Aidit.",“ lebih jauh prijanto mengatakan istilah petugas partai disampaikan ketua umum pdip megawati soekarnoputri jokowi dinilai modus komunisme istilah petugas partai mirip pekerja partai pernah dikatakan tokoh pki dn aidit,"['“', 'lebih', 'jauh', 'prijanto', 'mengatakan', 'istilah', 'petugas', 'partai', 'disampaikan', 'ketua', 'umum', 'pdip', 'megawati', 'soekarnoputri', 'jokowi', 'dinilai', 'modus', 'komunisme', 'istilah', 'petugas', 'partai', 'mirip', 'pekerja', 'partai', 'pernah', 'dikatakan', 'tokoh', 'pki', 'dn', 'aidit']",<FreqDist with 26 samples and 30 outcomes>,"['', 'lebih', 'jauh', 'prijanto', 'kata', 'istilah', 'tugas', 'partai', 'sampai', 'ketua', 'umum', 'pdip', 'megawati', 'soekarnoputri', 'jokowi', 'nilai', 'modus', 'komunisme', 'istilah', 'tugas', 'partai', 'mirip', 'kerja', 'partai', 'pernah', 'kata', 'tokoh', 'pki', 'dn', 'aidit']",-6,negative,-1
Gubernur Jakarta Anies Baswedan mendapat penghargaan terbaik di seluruh dunia dalam penanganan COVID-19,GUBERNUR JAKARTA ANIES BASWEDAN MENDAPAT PENGHARGAAN TERBAIK DI SELURUH DUNIA DALAM PENANGANAN COVID-19,gubernur jakarta anies baswedan mendapat penghargaan terbaik seluruh dunia penanganan covid,"['gubernur', 'jakarta', 'anies', 'baswedan', 'mendapat', 'penghargaan', 'terbaik', 'seluruh', 'dunia', 'penanganan', 'covid']",<FreqDist with 11 samples and 11 outcomes>,"['gubernur', 'jakarta', 'anies', 'baswedan', 'dapat', 'harga', 'baik', 'seluruh', 'dunia', 'tangan', 'covid']",12,positive,1
masyarakat New Zealand belajar Wudhu,"Kabar Terbaru dari NEW ZEALAND Subhanallah,,,, masyarakat New Zealand pd belajar Wudhu. Dan Kumpul di Lapangan. Mereka Mulai Belajar dan Mendalami Islam Kalau Allah Sudah Berkehendak,, ! Semua bisa terjadi. Allahu Akbar !!! Sungguh Allah Maha Pembolak Balik Hati Manusia",kabar terbaru new zealand subhanallah masyarakat new zealand belajar wudhu kumpul lapangan mulai belajar mendalami islam kalau allah berkehendak semua terjadi allahu akbar sungguh allah maha pembolak balik hati manusia,"['kabar', 'terbaru', 'new', 'zealand', 'subhanallah', 'masyarakat', 'new', 'zealand', 'belajar', 'wudhu', 'kumpul', 'lapangan', 'mulai', 'belajar', 'mendalami', 'islam', 'kalau', 'allah', 'berkehendak', 'semua', 'terjadi', 'allahu', 'akbar', 'sungguh', 'allah', 'maha', 'pembolak', 'balik', 'hati', 'manusia']",<FreqDist with 26 samples and 30 outcomes>,"['kabar', 'baru', 'new', 'zealand', 'subhanallah', 'masyarakat', 'new', 'zealand', 'ajar', 'wudhu', 'kumpul', 'lapang', 'mulai', 'ajar', 'dalam', 'islam', 'kalau', 'allah', 'hendak', 'semua', 'jadi', 'allahu', 'akbar', 'sungguh', 'allah', 'maha', 'bolak', 'balik', 'hati', 'manusia']",33,positive,1
Sejumlah Polisi India Telah Tiba Di Indonesia,Kabar Terkini.. Sejumlah Polisi India Telah Tiba Di Indonesia Untuk menertibkan Masyarakat yg tdk mau tinggal di rumah..Siapkan Pantat dan Minyak Gosok.,kabar terkini sejumlah polisi india tiba indonesia menertibkan masyarakat tdk mau tinggal rumahsiapkan pantat minyak gosok,"['kabar', 'terkini', 'sejumlah', 'polisi', 'india', 'tiba', 'indonesia', 'menertibkan', 'masyarakat', 'tdk', 'mau', 'tinggal', 'rumahsiapkan', 'pantat', 'minyak', 'gosok']",<FreqDist with 16 samples and 16 outcomes>,"['kabar', 'kini', 'jumlah', 'polisi', 'india', 'tiba', 'indonesia', 'tertib', 'masyarakat', 'tdk', 'mau', 'tinggal', 'rumahsiapkan', 'pantat', 'minyak', 'gosok']",-1,negative,-1
Pasukan Tentara Membantu Melawan Virus Corona di New York,Military vehicles arrived in Manhattan.NEW YORK WUHAN CORONAVIRUS,military vehicles arrived in manhattannew york wuhan coronavirus,"['military', 'vehicles', 'arrived', 'in', 'manhattannew', 'york', 'wuhan', 'coronavirus']",<FreqDist with 8 samples and 8 outcomes>,"['military', 'vehicles', 'arrived', 'in', 'manhattannew', 'york', 'wuhan', 'coronavirus']",0,negative,-1
Video KELUYURAN DILUAR RUMAH? DI MALAYSIA DITEMBAK API PAKAI DRONE,"KELUYURAN DILUAR RUMAH…??
 DI MALAYSIA DITEMBAK API PAKAI DRONE….",keluyuran diluar rumah… malaysia ditembak api pakai drone…,"['keluyuran', 'diluar', 'rumah…', 'malaysia', 'ditembak', 'api', 'pakai', 'drone…']",<FreqDist with 8 samples and 8 outcomes>,"['keluyur', 'luar', 'rumah', 'malaysia', 'tembak', 'api', 'pakai', 'drone']",2,positive,1
"Antisipasi Corona, Seluruh BUMN DKI Ditutup","ANTISIPASI CORONA, SELURUH BUMN DKI DITUTUP",antisipasi corona seluruh bumn dki ditutup,"['antisipasi', 'corona', 'seluruh', 'bumn', 'dki', 'ditutup']",<FreqDist with 6 samples and 6 outcomes>,"['antisipasi', 'corona', 'seluruh', 'bumn', 'dki', 'tutup']",2,positive,1
Jokowi Halal Dilengserkan,Manusia yg gk punya nilai dn kuwalitas gk pantas mnjdi apapun di negeri ini..,manusia gk punya nilai dn kuwalitas gk pantas mnjdi apapun negeri,"['manusia', 'gk', 'punya', 'nilai', 'dn', 'kuwalitas', 'gk', 'pantas', 'mnjdi', 'apapun', 'negeri']",<FreqDist with 10 samples and 11 outcomes>,"['manusia', 'gk', 'punya', 'nilai', 'dn', 'kuwalitas', 'gk', 'pantas', 'mnjdi', 'apa', 'negeri']",7,positive,1
"Sandiwara Dagelan koplax, di perskusi sendiri,di viralkan sendiri,di laporkan sendiri, minta maaf dan memaafkan sendiri","Sandiwara Dagelan koplax, di perskusi sendiri,di viralkan sendiri,di laporkan sendiri, minta maaf dan memaafkan sendiri? Sakit jiwa kali yang beginian ya?",sandiwara dagelan koplax perskusi sendiridi viralkan sendiridi laporkan sendiri minta maaf memaafkan sendiri sakit jiwa kali beginian,"['sandiwara', 'dagelan', 'koplax', 'perskusi', 'sendiridi', 'viralkan', 'sendiridi', 'laporkan', 'sendiri', 'minta', 'maaf', 'memaafkan', 'sendiri', 'sakit', 'jiwa', 'kali', 'beginian']",<FreqDist with 15 samples and 17 outcomes>,"['sandiwara', 'dagel', 'koplax', 'perskusi', 'sendiridi', 'viralkan', 'sendiridi', 'lapor', 'sendiri', 'minta', 'maaf', 'maaf', 'sendiri', 'sakit', 'jiwa', 'kali', 'begini']",-14,negative,-1
"Beredar Surat Rekrutmen Satpol PP, Kepala Satpol PP dan Damkar Sintang Angkat Bicara","Kepala Satpol PP dan Damkar, Martin Nandung: “Gak jelas sumber dan tidak ada penanggungjawab. Ndak ada cap dan tanda tangan,",kepala satpol pp damkar martin nandung “ gak jelas sumber tidak penanggungjawab ndak cap tanda tangan,"['kepala', 'satpol', 'pp', 'damkar', 'martin', 'nandung', '“', 'gak', 'jelas', 'sumber', 'tidak', 'penanggungjawab', 'ndak', 'cap', 'tanda', 'tangan']",<FreqDist with 16 samples and 16 outcomes>,"['kepala', 'satpol', 'pp', 'damkar', 'martin', 'nandung', '', 'gak', 'jelas', 'sumber', 'tidak', 'penanggungjawab', 'ndak', 'cap', 'tanda', 'tangan']",-11,negative,-1
Ketua KPU Imbau Masyarakat Hormati Hasil Pemilu Walau Banyak Kecurangan,"Ketua KPU Imbau Masyarakat Hormati Hasil Pemilu Walau Banyak Kecurangan,",ketua kpu imbau masyarakat hormati hasil pemilu banyak kecurangan,"['ketua', 'kpu', 'imbau', 'masyarakat', 'hormati', 'hasil', 'pemilu', 'banyak', 'kecurangan']",<FreqDist with 9 samples and 9 outcomes>,"['ketua', 'kpu', 'imbau', 'masyarakat', 'hormat', 'hasil', 'milu', 'banyak', 'curang']",3,positive,1
Universitas Brawijaya dan UMM Bantah Liburkan Perkuliahan karena Ada Aksi Mahasiswa,"Hoaks, mbak. Kegiatan belajar normal, kegiatan kampus juga normal",hoaks mbak kegiatan belajar normal kegiatan kampus normal,"['hoaks', 'mbak', 'kegiatan', 'belajar', 'normal', 'kegiatan', 'kampus', 'normal']",<FreqDist with 6 samples and 8 outcomes>,"['hoaks', 'mbak', 'giat', 'ajar', 'normal', 'giat', 'kampus', 'normal']",11,positive,1
Luthfi Abdul Hadi Meminta Maaf kepada Kiai Said Aqil Siroj,"Akhirnya Gus Ipul wakil Gubernur jatim turun tangan menyelesaikan FITNAH yg di tuduhkan kepada ketum PBNU PROF DR KH Said Aqil Siroj.
 Semoga para tukang fitnah tidak kejang2 …",akhirnya gus ipul wakil gubernur jatim turun tangan menyelesaikan fitnah di tuduhkan ketum pbnu prof kh said aqil siroj semoga tukang fitnah kejang …,"['akhirnya', 'gus', 'ipul', 'wakil', 'gubernur', 'jatim', 'turun', 'tangan', 'menyelesaikan', 'fitnah', 'di', 'tuduhkan', 'ketum', 'pbnu', 'prof', 'kh', 'said', 'aqil', 'siroj', 'semoga', 'tukang', 'fitnah', 'kejang', '…']",<FreqDist with 23 samples and 24 outcomes>,"['akhir', 'gus', 'ipul', 'wakil', 'gubernur', 'jatim', 'turun', 'tangan', 'selesai', 'fitnah', 'di', 'tuduh', 'tum', 'pbnu', 'prof', 'kh', 'said', 'aqil', 'siroj', 'moga', 'tukang', 'fitnah', 'kejang', '']",-13,negative,-1
Asosiasi Guru Bahasa dan Sastra Indonesia Kecam Anies Baswedan,Asosiasi Guru Bahasa dan Sastra Indonesia Kecam Anies Baswedan Lihai Tata Kata untuk Bodohi Warga Jakarta,asosiasi guru bahasa sastra indonesia kecam anies baswedan lihai tata kata bodohi warga jakarta,"['asosiasi', 'guru', 'bahasa', 'sastra', 'indonesia', 'kecam', 'anies', 'baswedan', 'lihai', 'tata', 'kata', 'bodohi', 'warga', 'jakarta']",<FreqDist with 14 samples and 14 outcomes>,"['asosiasi', 'guru', 'bahasa', 'sastra', 'indonesia', 'kecam', 'anies', 'baswedan', 'lihai', 'tata', 'kata', 'bodoh', 'warga', 'jakarta']",-2,negative,-1
Khoirul Anwar Penemu 4G LTE,"Khoirul Anwar dianggap gila. Ditertawakan. Bahkan dicemooh. Idenya dianggap muskil. Tak masuk akal. Semua ilmuwan yang berkumpul di Hokkaido, Jepang, itu menganggap pemikiran yang dipresentasikan itu tak berguna. …",khoirul anwar dianggap gila ditertawakan bahkan dicemooh idenya dianggap muskil tak masuk akal semua ilmuwan berkumpul hokkaido jepang menganggap pemikiran dipresentasikan tak berguna …,"['khoirul', 'anwar', 'dianggap', 'gila', 'ditertawakan', 'bahkan', 'dicemooh', 'idenya', 'dianggap', 'muskil', 'tak', 'masuk', 'akal', 'semua', 'ilmuwan', 'berkumpul', 'hokkaido', 'jepang', 'menganggap', 'pemikiran', 'dipresentasikan', 'tak', 'berguna', '…']",<FreqDist with 22 samples and 24 outcomes>,"['khoirul', 'anwar', 'anggap', 'gila', 'tertawa', 'bahkan', 'cemooh', 'ide', 'anggap', 'muskil', 'tak', 'masuk', 'akal', 'semua', 'ilmuwan', 'kumpul', 'hokkaido', 'jepang', 'anggap', 'pikir', 'presentasi', 'tak', 'guna', '']",-4,negative,-1
Syukuran Jokowi 2 p,"Syukuran Jokowi 2 p,, tnp kamera ,bawa bekal sendiri, kompak,, salam Jokowi",syukuran jokowi p tnp kamera bawa bekal sendiri kompak salam jokowi,"['syukuran', 'jokowi', 'p', 'tnp', 'kamera', 'bawa', 'bekal', 'sendiri', 'kompak', 'salam', 'jokowi']",<FreqDist with 10 samples and 11 outcomes>,"['syukur', 'jokowi', 'p', 'tnp', 'kamera', 'bawa', 'bekal', 'sendiri', 'kompak', 'salam', 'jokowi']",-2,negative,-1
Video Polisi Tembak Saksi Saat Rekap Pleno KPU,Polisi menembak saksi yang tidak trima rekap pleno KPU,polisi menembak saksi tidak trima rekap pleno kpu,"['polisi', 'menembak', 'saksi', 'tidak', 'trima', 'rekap', 'pleno', 'kpu']",<FreqDist with 8 samples and 8 outcomes>,"['polisi', 'tembak', 'saksi', 'tidak', 'trima', 'rekap', 'pleno', 'kpu']",-3,negative,-1
Penjelasan KPU Gowa terkait Baliho Surat Suara yang Tidak Mencantumkan Foto Capres-Cawapres Prabowo-Sandi,"Hari ini
Pemasangan baliho contoh surat suara Pilpres 
oleh KPU
Di Kec Bontonompo Kab Gowa
Mana foto capres cawapres 02?
Luar Biasa KPU Gowa
Kalian sudah mencederai demokrasi",hari ini pemasangan baliho contoh surat suara pilpres oleh kpu di kec bontonompo kab gowa mana foto capres cawapres luar biasa kpu gowa kalian mencederai demokrasi,"['hari', 'ini', 'pemasangan', 'baliho', 'contoh', 'surat', 'suara', 'pilpres', 'oleh', 'kpu', 'di', 'kec', 'bontonompo', 'kab', 'gowa', 'mana', 'foto', 'capres', 'cawapres', 'luar', 'biasa', 'kpu', 'gowa', 'kalian', 'mencederai', 'demokrasi']",<FreqDist with 24 samples and 26 outcomes>,"['hari', 'ini', 'pasang', 'baliho', 'contoh', 'surat', 'suara', 'pilpres', 'oleh', 'kpu', 'di', 'kec', 'bontonompo', 'kab', 'gowa', 'mana', 'foto', 'capres', 'cawapres', 'luar', 'biasa', 'kpu', 'gowa', 'kalian', 'cedera', 'demokrasi']",-2,negative,-1
Masukan Persatuan Tunanetra Indonesia Terkait Braile Surat Suara di Jakarta 80% Salah Semua,"Info dari Pertuni

Ini masukan aja tadi dari Pertuni (persatuan tunanetra Indonesia) yg di Jkt ngecek surat suara yg braile ke KPU ternyata hampir 80% salah semua",info pertuni ini masukan aja tadi pertuni persatuan tunanetra indonesia di jkt ngecek surat suara braile kpu ternyata hampir salah semua,"['info', 'pertuni', 'ini', 'masukan', 'aja', 'tadi', 'pertuni', 'persatuan', 'tunanetra', 'indonesia', 'di', 'jkt', 'ngecek', 'surat', 'suara', 'braile', 'kpu', 'ternyata', 'hampir', 'salah', 'semua']",<FreqDist with 20 samples and 21 outcomes>,"['info', 'tun', 'ini', 'masuk', 'aja', 'tadi', 'tun', 'satu', 'tunanetra', 'indonesia', 'di', 'jkt', 'ngecek', 'surat', 'suara', 'braile', 'kpu', 'nyata', 'hampir', 'salah', 'semua']",-8,negative,-1
Kementan Bantah Siluet Wajah yang Ada Dibungkus Plastik Bertuliskan Beras Segar dan Toko Tani Indonesia ialah Presiden Jokowi,"“Gambar atau foto yang tertera pada kemasan beras Toko Tani Indonesia adalah bukan foto Presiden RI Bapak Jokowi. Itu foto model staf Kementan di Biro Umum dan Pengadaan Kementan, Mas Agus Faizal,” kata Kepala Biro Humas dan Informasi Publik Kementan, Kuntoro Boga Andri, Selasa (25/9).",“ gambar foto tertera kemasan beras toko tani indonesia bukan foto presiden ri bapak jokowi foto model staf kementan biro umum pengadaan kementan mas agus faizal ” kata kepala biro humas informasi publik kementan kuntoro boga andri selasa,"['“', 'gambar', 'foto', 'tertera', 'kemasan', 'beras', 'toko', 'tani', 'indonesia', 'bukan', 'foto', 'presiden', 'ri', 'bapak', 'jokowi', 'foto', 'model', 'staf', 'kementan', 'biro', 'umum', 'pengadaan', 'kementan', 'mas', 'agus', 'faizal', '”', 'kata', 'kepala', 'biro', 'humas', 'informasi', 'publik', 'kementan', 'kuntoro', 'boga', 'andri', 'selasa']",<FreqDist with 33 samples and 38 outcomes>,"['', 'gambar', 'foto', 'tera', 'kemas', 'beras', 'toko', 'tani', 'indonesia', 'bukan', 'foto', 'presiden', 'ri', 'bapak', 'jokowi', 'foto', 'model', 'staf', 'tan', 'biro', 'umum', 'ada', 'tan', 'mas', 'agus', 'faizal', '', 'kata', 'kepala', 'biro', 'humas', 'informasi', 'publik', 'tan', 'kuntoro', 'boga', 'andri', 'selasa']",10,positive,1
Dinkes Aceh Membantah Atas Isu Pelajar Lumpuh Setelah Vaksin MR,"“Itu secara kebetulan. Tidak berhubungan dengan imunisasi. Ini penyakit sendiri bukan efek dari vaksin MR,” ujarnya.",“ itu kebetulan berhubungan imunisasi penyakit sendiri bukan efek vaksin mr ” ujarnya,"['“', 'itu', 'kebetulan', 'berhubungan', 'imunisasi', 'penyakit', 'sendiri', 'bukan', 'efek', 'vaksin', 'mr', '”', 'ujarnya']",<FreqDist with 13 samples and 13 outcomes>,"['', 'itu', 'betul', 'hubung', 'imunisasi', 'sakit', 'sendiri', 'bukan', 'efek', 'vaksin', 'mr', '', 'ujar']",-9,negative,-1
Hasil Scanning Port Bolong,"KPU harusnya punya server sendiri. Ini bawa2 ITB, Moratel.. Gimana pemilu berikutnya…",kpu harusnya punya server sendiri bawa itb moratel gimana pemilu berikutnya…,"['kpu', 'harusnya', 'punya', 'server', 'sendiri', 'bawa', 'itb', 'moratel', 'gimana', 'pemilu', 'berikutnya…']",<FreqDist with 11 samples and 11 outcomes>,"['kpu', 'harus', 'punya', 'server', 'sendiri', 'bawa', 'itb', 'moratel', 'gimana', 'milu', 'ikut']",-2,negative,-1
REKRUTMEN PT PINDAD,Sehubungan dengan rekrutmen calon karyawan pada pt pindad untuk wilayah kerja meliputi Region Sulawesi,sehubungan rekrutmen calon karyawan pt pindad wilayah kerja meliputi region sulawesi,"['sehubungan', 'rekrutmen', 'calon', 'karyawan', 'pt', 'pindad', 'wilayah', 'kerja', 'meliputi', 'region', 'sulawesi']",<FreqDist with 11 samples and 11 outcomes>,"['hubung', 'rekrutmen', 'calon', 'karyawan', 'pt', 'pindad', 'wilayah', 'kerja', 'liput', 'region', 'sulawesi']",2,positive,1
: Maradona Bantah Kabar Dirinya Meninggal Usai Laga Argentina vs Nigeria Pada Piala Dunia 2018,: Maradona Bantah Kabar Dirinya Meninggal Usai Laga Argentina vs Nigeria Pada Piala Dunia 2018,maradona bantah kabar dirinya meninggal usai laga argentina vs nigeria piala dunia,"['maradona', 'bantah', 'kabar', 'dirinya', 'meninggal', 'usai', 'laga', 'argentina', 'vs', 'nigeria', 'piala', 'dunia']",<FreqDist with 12 samples and 12 outcomes>,"['maradona', 'bantah', 'kabar', 'diri', 'tinggal', 'usai', 'laga', 'argentina', 'vs', 'nigeria', 'piala', 'dunia']",-8,negative,-1
"Mark Zuckerberg, CEO Facebook, Menemukan Kata BFF","Test FB tmn2 disini……
 
 Mark Zuckerberg, CEO Facebook, menemukan kata BFF, untuk memastikan akun anda aman di facebook. Ketik Bff di komentar,
 Jika terlihat hijau, akun anda dilindungi.
 Jika tidak muncul dalam warna hijau, ubah kata sandi anda segera karena mungkin diretas oleh seseorang.
 # Copied",test fb tmn disini…… mark zuckerberg ceo facebook menemukan kata bff memastikan akun aman facebook ketik bff komentar terlihat hijau akun dilindungi tidak muncul warna hijau ubah kata sandi segera mungkin diretas seseorang copied,"['test', 'fb', 'tmn', 'disini……', 'mark', 'zuckerberg', 'ceo', 'facebook', 'menemukan', 'kata', 'bff', 'memastikan', 'akun', 'aman', 'facebook', 'ketik', 'bff', 'komentar', 'terlihat', 'hijau', 'akun', 'dilindungi', 'tidak', 'muncul', 'warna', 'hijau', 'ubah', 'kata', 'sandi', 'segera', 'mungkin', 'diretas', 'seseorang', 'copied']",<FreqDist with 29 samples and 34 outcomes>,"['test', 'fb', 'tmn', 'sini', 'mark', 'zuckerberg', 'ceo', 'facebook', 'temu', 'kata', 'bff', 'pasti', 'akun', 'aman', 'facebook', 'ketik', 'bff', 'komentar', 'lihat', 'hijau', 'akun', 'lindung', 'tidak', 'muncul', 'warna', 'hijau', 'ubah', 'kata', 'sandi', 'segera', 'mungkin', 'retas', 'orang', 'copied']",-2,negative,-1
