judul,narasi,clear,token_komen,freq_words,stemmed_komen,polarity_score,polarity,score
some say the sound of a whale,"Thrill voice from the bottom of the Sea, some say the sound of a whale.But in a history, when the Dajjal Laknatullah, will come out of the chains bondage will be heard a shrill voice, namely the voice of Dabbatul Arz. Allah knows’ ak’lam (only Allah knows).",thrill voice from the bottom of the sea some say the sound of a whalebut in a history when the dajjal laknatullah will come out of the chains bondage will be heard a shrill voice namely the voice of dabbatul arz allah knows ’ ak ’ lam only allah knows,"['thrill', 'voice', 'from', 'the', 'bottom', 'of', 'the', 'sea', 'some', 'say', 'the', 'sound', 'of', 'a', 'whalebut', 'in', 'a', 'history', 'when', 'the', 'dajjal', 'laknatullah', 'will', 'come', 'out', 'of', 'the', 'chains', 'bondage', 'will', 'be', 'heard', 'a', 'shrill', 'voice', 'namely', 'the', 'voice', 'of', 'dabbatul', 'arz', 'allah', 'knows', '’', 'ak', '’', 'lam', 'only', 'allah', 'knows']",<FreqDist with 34 samples and 50 outcomes>,"['thrill', 'voice', 'from', 'the', 'bottom', 'of', 'the', 'sea', 'some', 'say', 'the', 'sound', 'of', 'a', 'whalebut', 'in', 'a', 'history', 'when', 'the', 'dajjal', 'laknatullah', 'will', 'come', 'out', 'of', 'the', 'chains', 'bondage', 'will', 'be', 'heard', 'a', 'shrill', 'voice', 'namely', 'the', 'voice', 'of', 'dabbatul', 'arz', 'allah', 'knows', '', 'ak', '', 'lam', 'only', 'allah', 'knows']",15,positive,1
Aa Gym Angkat Bicara Terkait Broadcast Silakan Ucapkan Selamat Natal Yang Catut Namanya,"Perlu disampaikan bahwa tulisan itu bukan tulisan Aa,
 
 Sayang sekali penulisnya berbohong atas nama orang lain, sebuah perbuatan yang tak dapat dibenarkan apapun niatnya.. Semoga penulis bisa menyadari kesalahannya dan tobat,",perlu disampaikan tulisan bukan tulisan aa sayang sekali penulisnya berbohong atas nama orang sebuah perbuatan tak dibenarkan apapun niatnya semoga penulis menyadari kesalahannya tobat,"['perlu', 'disampaikan', 'tulisan', 'bukan', 'tulisan', 'aa', 'sayang', 'sekali', 'penulisnya', 'berbohong', 'atas', 'nama', 'orang', 'sebuah', 'perbuatan', 'tak', 'dibenarkan', 'apapun', 'niatnya', 'semoga', 'penulis', 'menyadari', 'kesalahannya', 'tobat']",<FreqDist with 23 samples and 24 outcomes>,"['perlu', 'sampai', 'tulis', 'bukan', 'tulis', 'aa', 'sayang', 'sekali', 'tulis', 'bohong', 'atas', 'nama', 'orang', 'buah', 'buat', 'tak', 'benar', 'apa', 'niat', 'moga', 'tulis', 'sadar', 'salah', 'tobat']",-10,negative,-1
Nata De Coco Terbuat Dari Plastik dan Berbahaya Untuk Anak-Anak,Jangan beli minuman seperti nata de coco ini. Bahayanya seperti plastic TDK larut dalam perut,jangan beli minuman nata de coco bahayanya plastic tdk larut perut,"['jangan', 'beli', 'minuman', 'nata', 'de', 'coco', 'bahayanya', 'plastic', 'tdk', 'larut', 'perut']",<FreqDist with 11 samples and 11 outcomes>,"['jangan', 'beli', 'minum', 'nata', 'de', 'coco', 'bahaya', 'plastic', 'tdk', 'larut', 'perut']",-5,negative,-1
Pabrik Narkoba Yang Digrebek Di Tasikmalaya Semua Pelakunya Cina,PABRIK EXSTASI DI GRREBEG DI TASIKMALAYA PELAKUNYA SEEEEMUA CINA…MASIH BERSEKONGKOL DG CINA ?,pabrik exstasi grrebeg tasikmalaya pelakunya seeeemua cina…masih bersekongkol dg cina,"['pabrik', 'exstasi', 'grrebeg', 'tasikmalaya', 'pelakunya', 'seeeemua', 'cina…masih', 'bersekongkol', 'dg', 'cina']",<FreqDist with 10 samples and 10 outcomes>,"['pabrik', 'exstasi', 'grrebeg', 'tasikmalaya', 'laku', 'seeeemua', 'cina masih', 'sekongkol', 'dg', 'cina']",-4,negative,-1
aseng mulai pake no seri mobil china,Terjadi di Bandung .. aseng mulai pake no seri mobil china …,terjadi bandung aseng mulai pake no seri mobil …,"['terjadi', 'bandung', 'aseng', 'mulai', 'pake', 'no', 'seri', 'mobil', '…']",<FreqDist with 9 samples and 9 outcomes>,"['jadi', 'bandung', 'aseng', 'mulai', 'pake', 'no', 'seri', 'mobil', '']",4,positive,1
Mahasiswa UINSU meninggal dunia saat melaksanakan demo di kota medan,"Adanya mahasiswa dari Universitas Islam Negeri Sumatera Utara yang meninggal saat melaksanakan aksi demo di kota Medan, Selasa 24 Agustus 2019.",adanya mahasiswa universitas islam negeri sumatera utara meninggal melaksanakan aksi demo kota medan selasa agustus,"['adanya', 'mahasiswa', 'universitas', 'islam', 'negeri', 'sumatera', 'utara', 'meninggal', 'melaksanakan', 'aksi', 'demo', 'kota', 'medan', 'selasa', 'agustus']",<FreqDist with 15 samples and 15 outcomes>,"['ada', 'mahasiswa', 'universitas', 'islam', 'negeri', 'sumatera', 'utara', 'tinggal', 'laksana', 'aksi', 'demo', 'kota', 'medan', 'selasa', 'agustus']",-5,negative,-1
Sri Mulyani Inginkan Dana Haji Rp 90 Triliun Untuk Menutupi Defisit BPJS,"Presiden Joko Widodo (Jokowi) menginginkan dana haji umat yang mencapai Rp 90 triliun dapat diinvestasikan ke berbagai instrumen investasi, seperti portofolio surat utang negara (SUN) maupun pembangunan infrastruktur juga menutupi depisit anggaran BPJS.",presiden joko widodo jokowi menginginkan dana haji umat mencapai rp triliun diinvestasikan berbagai instrumen investasi portofolio surat utang negara sun maupun pembangunan infrastruktur menutupi depisit anggaran bpjs,"['presiden', 'joko', 'widodo', 'jokowi', 'menginginkan', 'dana', 'haji', 'umat', 'mencapai', 'rp', 'triliun', 'diinvestasikan', 'berbagai', 'instrumen', 'investasi', 'portofolio', 'surat', 'utang', 'negara', 'sun', 'maupun', 'pembangunan', 'infrastruktur', 'menutupi', 'depisit', 'anggaran', 'bpjs']",<FreqDist with 27 samples and 27 outcomes>,"['presiden', 'joko', 'widodo', 'jokowi', 'ingin', 'dana', 'haji', 'umat', 'capai', 'rp', 'triliun', 'investasi', 'bagai', 'instrumen', 'investasi', 'portofolio', 'surat', 'utang', 'negara', 'sun', 'maupun', 'bangun', 'infrastruktur', 'tutup', 'depisit', 'anggar', 'bpjs']",12,positive,1
apa kyai kita mengakui bahwa kubu mereka curang ya ?,apa kyai kita mengakui bahwa kubu mereka curang ya ?,apa kyai mengakui kubu curang,"['apa', 'kyai', 'mengakui', 'kubu', 'curang']",<FreqDist with 5 samples and 5 outcomes>,"['apa', 'kyai', 'aku', 'kubu', 'curang']",-8,negative,-1
Penderita Gila akibat Pilpres meningkat tajam di sumbar,Penderita Gila akibat Pilpres meningkat tajam di sumbar.,penderita gila akibat pilpres meningkat tajam sumbar,"['penderita', 'gila', 'akibat', 'pilpres', 'meningkat', 'tajam', 'sumbar']",<FreqDist with 7 samples and 7 outcomes>,"['derita', 'gila', 'akibat', 'pilpres', 'tingkat', 'tajam', 'sumbar']",-2,negative,-1
Santunan Kecelakaan Jasa Raharja Naik 100 Persen,KORBAN /PASIEN Kecelakaan yang ga pny BPJS kesehatan ataupun BPJS ketenagakerjaan..,korban pasien kecelakaan ga pny bpjs kesehatan ataupun bpjs ketenagakerjaan,"['korban', 'pasien', 'kecelakaan', 'ga', 'pny', 'bpjs', 'kesehatan', 'ataupun', 'bpjs', 'ketenagakerjaan']",<FreqDist with 9 samples and 10 outcomes>,"['korban', 'pasien', 'celaka', 'ga', 'pny', 'bpjs', 'sehat', 'atau', 'bpjs', 'ketenagakerjaan']",-9,negative,-1
TERB0NGKAR KENAPA C1.N@ P.K! INGIN BELI SEMUA TANAH STRATEGI DIINDONESIA,GAWATTT…!!! TERB0NGKAR KENAPA C1.N@ P.K! INGIN BELI SEMUA TANAH STRATEGI DIINDONESIA,gawattt… terbngkar cn pk beli semua tanah strategi diindonesia,"['gawattt…', 'terbngkar', 'cn', 'pk', 'beli', 'semua', 'tanah', 'strategi', 'diindonesia']",<FreqDist with 9 samples and 9 outcomes>,"['gawattt', 'terbngkar', 'cn', 'pk', 'beli', 'semua', 'tanah', 'strategi', 'indonesia']",-4,negative,-1
Di Austria Lahar Panas keluar dari Perut Bumi,"[NAUZUBILLAH YA ALLAH]-Di Austria Lahar Panas keluar dari Perut Bumi.
Mungkin Neraka Merindukan Penghuni nya.",nauzubillah allahdi austria lahar panas keluar perut bumi mungkin neraka merindukan penghuni,"['nauzubillah', 'allahdi', 'austria', 'lahar', 'panas', 'keluar', 'perut', 'bumi', 'mungkin', 'neraka', 'merindukan', 'penghuni']",<FreqDist with 12 samples and 12 outcomes>,"['nauzubillah', 'allahdi', 'austria', 'lahar', 'panas', 'keluar', 'perut', 'bumi', 'mungkin', 'neraka', 'rindu', 'huni']",-2,negative,-1
Tol Jakarta - Cikampek Ambruk,"Maaff buat temen temen arah jakarta cikampek macet totol…jalan tol ambruk..,",maaff buat temen temen arah jakarta cikampek macet totol…jalan tol ambruk,"['maaff', 'buat', 'temen', 'temen', 'arah', 'jakarta', 'cikampek', 'macet', 'totol…jalan', 'tol', 'ambruk']",<FreqDist with 10 samples and 11 outcomes>,"['maaff', 'buat', 'temen', 'temen', 'arah', 'jakarta', 'cikampek', 'macet', 'totol jalan', 'tol', 'ambruk']",-7,negative,-1
FB LITE LAGI DI HACK,"INFO.
FB LITE LAGI DI HACK,
JIKA FB LITE ANDA SAAT BUKA PROFIL ORANG LAIN DAN MUNCUL FOTO PROFIL ANDA SENDIRI, BERARTI FB ANDA TERKENA VIRUS, CARA MENGHILANGKANNYA IKUTI LANGKAH BERIKUT",info fb lite di hack jika fb lite saat buka profil orang dan muncul foto profil sendiri berarti fb terkena virus cara menghilangkannya ikuti langkah berikut,"['info', 'fb', 'lite', 'di', 'hack', 'jika', 'fb', 'lite', 'saat', 'buka', 'profil', 'orang', 'dan', 'muncul', 'foto', 'profil', 'sendiri', 'berarti', 'fb', 'terkena', 'virus', 'cara', 'menghilangkannya', 'ikuti', 'langkah', 'berikut']",<FreqDist with 22 samples and 26 outcomes>,"['info', 'fb', 'lite', 'di', 'hack', 'jika', 'fb', 'lite', 'saat', 'buka', 'profil', 'orang', 'dan', 'muncul', 'foto', 'profil', 'sendiri', 'arti', 'fb', 'kena', 'virus', 'cara', 'hilang', 'ikut', 'langkah', 'ikut']",-4,negative,-1
Munir Dibunuh Setelah Menyatakan Prabowo Tidak Bersalah,Munir tewas terbunuh satu bulan setelah wawancara di stasiun televisi swasta itu terjadi;,munir tewas terbunuh satu bulan wawancara stasiun televisi swasta terjadi,"['munir', 'tewas', 'terbunuh', 'satu', 'bulan', 'wawancara', 'stasiun', 'televisi', 'swasta', 'terjadi']",<FreqDist with 10 samples and 10 outcomes>,"['munir', 'tewas', 'bunuh', 'satu', 'bulan', 'wawancara', 'stasiun', 'televisi', 'swasta', 'jadi']",3,positive,1
Megawati Soekarnoputri Dirawat di Rumah Sakit karena Stroke,"Untuk seluruh rakyat Indonesia
Mari kita doakan agar Ibu Megawati Presiden kita ke 5, yang sekarang ini sedang dirawat di rumah sakit, diangkat penyakit strokenya, diberikan kesehatan sehingga bisa membantu bpk Jokowi dipertarungan mempertahankan kursi RI 1",seluruh rakyat indonesia mari doakan ibu megawati presiden ke sekarang sedang dirawat rumah sakit diangkat penyakit strokenya diberikan kesehatan bisa membantu bpk jokowi dipertarungan mempertahankan kursi ri,"['seluruh', 'rakyat', 'indonesia', 'mari', 'doakan', 'ibu', 'megawati', 'presiden', 'ke', 'sekarang', 'sedang', 'dirawat', 'rumah', 'sakit', 'diangkat', 'penyakit', 'strokenya', 'diberikan', 'kesehatan', 'bisa', 'membantu', 'bpk', 'jokowi', 'dipertarungan', 'mempertahankan', 'kursi', 'ri']",<FreqDist with 27 samples and 27 outcomes>,"['seluruh', 'rakyat', 'indonesia', 'mari', 'doa', 'ibu', 'megawati', 'presiden', 'ke', 'sekarang', 'sedang', 'rawat', 'rumah', 'sakit', 'angkat', 'sakit', 'stroke', 'beri', 'sehat', 'bisa', 'bantu', 'bpk', 'jokowi', 'tarung', 'tahan', 'kursi', 'ri']",0,negative,-1
Penemuan Mayat Seorang Anak Kelas Satu SDN Pademangan Barat 11 Kemayoran,"Telah ditemukan mayat seorang anak SDN Pademangan Barat 11 kelas satu pada pukul 22.00 di Kemayoran,,, dgn kondisi yang mengenaskan yaitu anggota organ tubuh bagian dalamnya telah diambil dan dijual oleh pelaku. Menghilang saat pulang sekolah. Akibat orang tua telat menjemput.",ditemukan mayat seorang anak sdn pademangan barat kelas satu pukul kemayoran kondisi mengenaskan anggota organ tubuh bagian dalamnya diambil dijual pelaku menghilang pulang sekolah akibat orang tua telat menjemput,"['ditemukan', 'mayat', 'seorang', 'anak', 'sdn', 'pademangan', 'barat', 'kelas', 'satu', 'pukul', 'kemayoran', 'kondisi', 'mengenaskan', 'anggota', 'organ', 'tubuh', 'bagian', 'dalamnya', 'diambil', 'dijual', 'pelaku', 'menghilang', 'pulang', 'sekolah', 'akibat', 'orang', 'tua', 'telat', 'menjemput']",<FreqDist with 29 samples and 29 outcomes>,"['temu', 'mayat', 'orang', 'anak', 'sdn', 'pademangan', 'barat', 'kelas', 'satu', 'pukul', 'mayor', 'kondisi', 'enas', 'anggota', 'organ', 'tubuh', 'bagi', 'dalam', 'ambil', 'jual', 'laku', 'hilang', 'pulang', 'sekolah', 'akibat', 'orang', 'tua', 'telat', 'jemput']",-33,negative,-1
NOMOR PORSI HAJI KEBERANGKATAN TAHUN 2018 HINGGA 2030,Smg bermanfaat Nomor Porsi Haji Reguler Tahun 2018 s/d Tahun 2030,smg bermanfaat nomor porsi haji reguler tahun sd tahun,"['smg', 'bermanfaat', 'nomor', 'porsi', 'haji', 'reguler', 'tahun', 'sd', 'tahun']",<FreqDist with 8 samples and 9 outcomes>,"['smg', 'manfaat', 'nomor', 'porsi', 'haji', 'reguler', 'tahun', 'sd', 'tahun']",9,positive,1
"Indonesia ku sayang, Indonesia ku malang","Indonesia ku sayang, Indonesia ku malang.",indonesia ku sayang indonesia ku malang,"['indonesia', 'ku', 'sayang', 'indonesia', 'ku', 'malang']",<FreqDist with 4 samples and 6 outcomes>,"['indonesia', 'ku', 'sayang', 'indonesia', 'ku', 'malang']",-5,negative,-1
PEMOGE TEWAS DI JALUR ALTERNATIF CIKIDANG,keluarga mnunggu anda,keluarga mnunggu,"['keluarga', 'mnunggu']",<FreqDist with 2 samples and 2 outcomes>,"['keluarga', 'mnunggu']",1,positive,1
Gedung Kementrian Pun Akan Dijual,GEDUNG KEMENTRIANPUN AKAN DIJUAL…?,gedung kementrianpun dijual…,"['gedung', 'kementrianpun', 'dijual…']",<FreqDist with 3 samples and 3 outcomes>,"['gedung', 'tri', 'jual']",0,negative,-1
"Sadarlah Wahai Rakyat Indonesia, Kita Ini Sedang Di Jajah","Indonesia ku sayang, Indonesia ku malang.
 Sadarlah wahai Rakyat Indonesia, kita ini sedang di jajah",indonesia ku sayang indonesia ku malang sadarlah wahai rakyat indonesia ini sedang jajah,"['indonesia', 'ku', 'sayang', 'indonesia', 'ku', 'malang', 'sadarlah', 'wahai', 'rakyat', 'indonesia', 'ini', 'sedang', 'jajah']",<FreqDist with 10 samples and 13 outcomes>,"['indonesia', 'ku', 'sayang', 'indonesia', 'ku', 'malang', 'sadar', 'wahai', 'rakyat', 'indonesia', 'ini', 'sedang', 'jajah']",-10,negative,-1
Pulau Kita di Kabupaten Berau Sudah Dijual,"Pulau kita di Kab. Berau sudah dijual kah..
 Nah.. Kapan nih giliran kita di jual juga",pulau di kab berau dijual kah nah kapan giliran di jual,"['pulau', 'di', 'kab', 'berau', 'dijual', 'kah', 'nah', 'kapan', 'giliran', 'di', 'jual']",<FreqDist with 10 samples and 11 outcomes>,"['pulau', 'di', 'kab', 'rau', 'jual', 'kah', 'nah', 'kapan', 'gilir', 'di', 'jual']",4,positive,1
9 Merek Pembalut di Indonesia Penyebab Kanker,"Kemenkes: “yang digunakan (dalam produksi pembalut) adalah klorin dioksida sebagai agen pemutih dan ini dinyatakan bebas dioksin, dan ini bukan gas klorin.”",kemenkes “ yang digunakan produksi pembalut klorin dioksida agen pemutih ini dinyatakan bebas dioksin ini bukan gas klorin ”,"['kemenkes', '“', 'yang', 'digunakan', 'produksi', 'pembalut', 'klorin', 'dioksida', 'agen', 'pemutih', 'ini', 'dinyatakan', 'bebas', 'dioksin', 'ini', 'bukan', 'gas', 'klorin', '”']",<FreqDist with 17 samples and 19 outcomes>,"['kemenkes', '', 'yang', 'guna', 'produksi', 'balut', 'klorin', 'dioksida', 'agen', 'mutih', 'ini', 'nyata', 'bebas', 'dioksin', 'ini', 'bukan', 'gas', 'klorin', '']",-22,negative,-1
Modus Pencabulan Dan Pembiusan Oleh Pengamen di Angkutan Kota Purwakarta,Modus Pencabulan Dan Pembiusan Oleh Pengamen di Angkutan Kota Purwakarta,modus pencabulan pembiusan pengamen angkutan kota purwakarta,"['modus', 'pencabulan', 'pembiusan', 'pengamen', 'angkutan', 'kota', 'purwakarta']",<FreqDist with 7 samples and 7 outcomes>,"['modus', 'cabul', 'bius', 'amen', 'angkut', 'kota', 'purwakarta']",-4,negative,-1
"Quraish Syihab Jadi Khatib Sholat Ied, Masjid Istiqlal Sepi Jamaah!","Quraish Syihab JADI Khatib, Jamaah Sholat Ied Istiqlal Sepi!",quraish syihab jadi khatib jamaah sholat ied istiqlal sepi,"['quraish', 'syihab', 'jadi', 'khatib', 'jamaah', 'sholat', 'ied', 'istiqlal', 'sepi']",<FreqDist with 9 samples and 9 outcomes>,"['quraish', 'syihab', 'jadi', 'khatib', 'jamaah', 'sholat', 'ied', 'istiqlal', 'sepi']",1,positive,1
: Anggota Kepolisian Tergabung Dalam Jaringan Radikalisme,"merekalah yg tak mementingkan pangkat dunia, mereka inginkan jihad rindu syahid di jln ALLAH. mereka di syria kita doakan perjuangan mereka berdua amin",merekalah tak mementingkan pangkat dunia inginkan jihad rindu syahid jln allah di syria doakan perjuangan berdua amin,"['merekalah', 'tak', 'mementingkan', 'pangkat', 'dunia', 'inginkan', 'jihad', 'rindu', 'syahid', 'jln', 'allah', 'di', 'syria', 'doakan', 'perjuangan', 'berdua', 'amin']",<FreqDist with 17 samples and 17 outcomes>,"['mereka', 'tak', 'penting', 'pangkat', 'dunia', 'ingin', 'jihad', 'rindu', 'syahid', 'jln', 'allah', 'di', 'syria', 'doa', 'juang', 'dua', 'amin']",16,positive,1
: Waspada SCAM Pesan Berantai Video Call Whatsapp,"[SCAM] Beredar broadcast aktivasi feature video call dengan pesan: “*Wow ! New Whatsapp Video calling Version is leaked with HD quality and many More features, Click on below link to Download !*",scam beredar broadcast aktivasi feature video call pesan “ wow new whatsapp video calling version is leaked with hd quality and many more features click on below link to download,"['scam', 'beredar', 'broadcast', 'aktivasi', 'feature', 'video', 'call', 'pesan', '“', 'wow', 'new', 'whatsapp', 'video', 'calling', 'version', 'is', 'leaked', 'with', 'hd', 'quality', 'and', 'many', 'more', 'features', 'click', 'on', 'below', 'link', 'to', 'download']",<FreqDist with 29 samples and 30 outcomes>,"['scam', 'edar', 'broadcast', 'aktivasi', 'feature', 'video', 'call', 'pesan', '', 'wow', 'new', 'whatsapp', 'video', 'calling', 'version', 'is', 'leaked', 'with', 'hd', 'quality', 'and', 'many', 'more', 'features', 'click', 'on', 'below', 'link', 'to', 'download']",3,positive,1
"Jenazah Siyono utuh, berarti ybs Mati Syahid",Kematian Siyono di tangan Densus 88 telah mencatatkan dirinya sebagai korban ke 121 terduga teroris yang langsung dibunuh tanpa bukti. Terdapat kisah menarik dalam jasad Siyono. Jasadnya tidak membusuk meskipun sudah hampir sebulan dikuburkan.,kematian siyono tangan densus mencatatkan dirinya korban terduga teroris langsung dibunuh bukti terdapat kisah menarik jasad siyono jasadnya membusuk meskipun hampir sebulan dikuburkan,"['kematian', 'siyono', 'tangan', 'densus', 'mencatatkan', 'dirinya', 'korban', 'terduga', 'teroris', 'langsung', 'dibunuh', 'bukti', 'terdapat', 'kisah', 'menarik', 'jasad', 'siyono', 'jasadnya', 'membusuk', 'meskipun', 'hampir', 'sebulan', 'dikuburkan']",<FreqDist with 22 samples and 23 outcomes>,"['mati', 'siyono', 'tangan', 'densus', 'catat', 'diri', 'korban', 'duga', 'teroris', 'langsung', 'bunuh', 'bukti', 'dapat', 'kisah', 'tarik', 'jasad', 'siyono', 'jasad', 'busuk', 'meski', 'hampir', 'bulan', 'kubur']",-10,negative,-1
"Pembangunan Jembatan Kolelet di Lebak, Banten","Apakah ini hoax, mohon informasinya…?",ini hoax mohon informasinya…,"['ini', 'hoax', 'mohon', 'informasinya…']",<FreqDist with 4 samples and 4 outcomes>,"['ini', 'hoax', 'mohon', 'informasi']",-5,negative,-1
Gambar Perjuangan FPI Tahun 1940 Melawan Penjajah dari Belanda,Perjuangan FPI tahun 1940 melawan penjajah dari Belanda.. Subhanallah,perjuangan fpi tahun melawan penjajah belanda subhanallah,"['perjuangan', 'fpi', 'tahun', 'melawan', 'penjajah', 'belanda', 'subhanallah']",<FreqDist with 7 samples and 7 outcomes>,"['juang', 'fpi', 'tahun', 'lawan', 'jajah', 'belanda', 'subhanallah']",0,negative,-1
Tangkapan Layar Wapres menyebut Idul Adha tak harus dimaknai dengan menyembelih qurban,Wapres menyebut Idul Adha tak harus dimaknai dengan menyembelih qurban,wapres menyebut idul adha tak dimaknai menyembelih qurban,"['wapres', 'menyebut', 'idul', 'adha', 'tak', 'dimaknai', 'menyembelih', 'qurban']",<FreqDist with 8 samples and 8 outcomes>,"['wapres', 'sebut', 'idul', 'adha', 'tak', 'makna', 'sembelih', 'qurban']",3,positive,1
Klaim Hadi Pranoto Soal COVID-19,Nama Prof. Hadi Pranoto sulit sekali di cari di internet. Ada tapi sedikit sekali. Padahal sejak bulan Mei beliau sudah menemukan Antibodi Covid 19 ini. Dan sekarang Antibodi Covid 19 ini sudah terbukti menyembuhkan banyak orang. Wisma Atlet pun mendapat pasokan obat ini dan pasien terbukti sembuh.,nama prof hadi pranoto sulit sekali cari internet tapi sedikit sekali padahal sejak bulan mei beliau menemukan antibodi covid dan sekarang antibodi covid sudah terbukti menyembuhkan banyak orang wisma atlet mendapat pasokan obat dan pasien terbukti sembuh,"['nama', 'prof', 'hadi', 'pranoto', 'sulit', 'sekali', 'cari', 'internet', 'tapi', 'sedikit', 'sekali', 'padahal', 'sejak', 'bulan', 'mei', 'beliau', 'menemukan', 'antibodi', 'covid', 'dan', 'sekarang', 'antibodi', 'covid', 'sudah', 'terbukti', 'menyembuhkan', 'banyak', 'orang', 'wisma', 'atlet', 'mendapat', 'pasokan', 'obat', 'dan', 'pasien', 'terbukti', 'sembuh']",<FreqDist with 32 samples and 37 outcomes>,"['nama', 'prof', 'had', 'pranoto', 'sulit', 'sekali', 'cari', 'internet', 'tapi', 'sedikit', 'sekali', 'padahal', 'sejak', 'bulan', 'mei', 'beliau', 'temu', 'antibodi', 'covid', 'dan', 'sekarang', 'antibodi', 'covid', 'sudah', 'bukti', 'sembuh', 'banyak', 'orang', 'wisma', 'atlet', 'dapat', 'pasok', 'obat', 'dan', 'pasien', 'bukti', 'sembuh']",3,positive,1
Status Gerakan Si Kadrun Harus di Hentikan,Gerakan si kadrun harus di hentikan.👊kami siap menunggu komando.🤟merdeka..!,gerakan si kadrun di hentikankami siap menunggu komandomerdeka,"['gerakan', 'si', 'kadrun', 'di', 'hentikankami', 'siap', 'menunggu', 'komandomerdeka']",<FreqDist with 8 samples and 8 outcomes>,"['gera', 'si', 'kadrun', 'di', 'hentikankami', 'siap', 'tunggu', 'komandomerdeka']",2,positive,1
"Artikel Ternyata Cium Janda 1 Menit Dapat Perpanjang Umur 1 Tahun, ini Faktanya","Ternyata Cium Janda 1 Menit Dapat Perpanjang Umur 1 Tahun, ini Faktanya.",ternyata cium janda menit perpanjang umur tahun faktanya,"['ternyata', 'cium', 'janda', 'menit', 'perpanjang', 'umur', 'tahun', 'faktanya']",<FreqDist with 8 samples and 8 outcomes>,"['nyata', 'cium', 'janda', 'menit', 'panjang', 'umur', 'tahun', 'fakta']",2,positive,1
Anak 10 Tahun Meninggal dan Tidak Bisa Keluar Rumah Sakit Akibat Terbentur Biaya,"KACAU BALAU PEMAHAMAN TENTANG BPJS SEPERTI INI – SETELAH SAYA CHECK TERNYATA YG BERSANGKUTAN TERPAPAR ALIRAN SESAT, MESKIPUN DEMIKIAN JPKP TETAP BANTU MENYELESAIKAN MASALAHNYA",kacau balau pemahaman bpjs ini – saya check ternyata bersangkutan terpapar aliran sesat meskipun jpkp tetap bantu menyelesaikan masalahnya,"['kacau', 'balau', 'pemahaman', 'bpjs', 'ini', '–', 'saya', 'check', 'ternyata', 'bersangkutan', 'terpapar', 'aliran', 'sesat', 'meskipun', 'jpkp', 'tetap', 'bantu', 'menyelesaikan', 'masalahnya']",<FreqDist with 19 samples and 19 outcomes>,"['kacau', 'balau', 'paham', 'bpjs', 'ini', '', 'saya', 'check', 'nyata', 'sangkut', 'papar', 'alir', 'sesat', 'meski', 'jpkp', 'tetap', 'bantu', 'selesai', 'masalah']",-6,negative,-1
Video nasehat dari alm. Erma Yunita Simamora yg meninggal pd tanggal. 20-04-2020 di RS AR Bunda Lbk Linggau,"KORBAN COVID-19 KISIMAK DG SEKSAMA… SAMPAI HABIS. Mari dengarkan nasehat dari alm. Erma Yunita Simamora yg meninggal pd tanggal. 20-04-2020 di RS AR Bunda Lbk Linggau. Semoga bermanfaat buat semua, semoga alm husnul khotimah. Aamiin YRA",korban covid kisimak dg seksama… habis dengarkan nasehat alm erma yunita simamora meninggal tanggal rs ar bunda lbk linggau semoga bermanfaat buat semua semoga alm husnul khotimah aamiin yra,"['korban', 'covid', 'kisimak', 'dg', 'seksama…', 'habis', 'dengarkan', 'nasehat', 'alm', 'erma', 'yunita', 'simamora', 'meninggal', 'tanggal', 'rs', 'ar', 'bunda', 'lbk', 'linggau', 'semoga', 'bermanfaat', 'buat', 'semua', 'semoga', 'alm', 'husnul', 'khotimah', 'aamiin', 'yra']",<FreqDist with 27 samples and 29 outcomes>,"['korban', 'covid', 'kisimak', 'dg', 'seksama', 'habis', 'dengar', 'nasehat', 'alm', 'erma', 'yunita', 'simamora', 'tinggal', 'tanggal', 'rs', 'ar', 'bunda', 'lbk', 'linggau', 'moga', 'manfaat', 'buat', 'semua', 'moga', 'alm', 'husnul', 'khotimah', 'aamiin', 'yra']",-9,negative,-1
Foto Hababina Rizieq sudah menjadi tangan kanan yang mulia Baginda Donald Trump,"Wooooi cebong, ini satu lagi bukti bahwa Imam Jumbo kami masih eksis dan tidak gembel di ngarab sana. Saat ini Hababina Rizieq sudah menjadi tangan kanan yang mulia Baginda Donald Trump. Bahkan kunci nuklir Mamarika udah ada ditangan beliau sekarang. Sekali lagi ente bilang dia gembel, bakal almarhum ente sekecamatan…",wooooi cebong satu bukti imam jumbo masih eksis tidak gembel ngarab sana ini hababina rizieq menjadi tangan kanan mulia baginda donald trump bahkan kunci nuklir mamarika udah ditangan beliau sekarang sekali ente bilang gembel bakal almarhum ente sekecamatan…,"['wooooi', 'cebong', 'satu', 'bukti', 'imam', 'jumbo', 'masih', 'eksis', 'tidak', 'gembel', 'ngarab', 'sana', 'ini', 'hababina', 'rizieq', 'menjadi', 'tangan', 'kanan', 'mulia', 'baginda', 'donald', 'trump', 'bahkan', 'kunci', 'nuklir', 'mamarika', 'udah', 'ditangan', 'beliau', 'sekarang', 'sekali', 'ente', 'bilang', 'gembel', 'bakal', 'almarhum', 'ente', 'sekecamatan…']",<FreqDist with 36 samples and 38 outcomes>,"['wooooi', 'cebong', 'satu', 'bukti', 'imam', 'jumbo', 'masih', 'eks', 'tidak', 'gembel', 'ngarab', 'sana', 'ini', 'hababina', 'rizieq', 'jadi', 'tangan', 'kanan', 'mulia', 'baginda', 'donald', 'trump', 'bahkan', 'kunci', 'nuklir', 'mamarika', 'udah', 'tang', 'beliau', 'sekarang', 'sekali', 'ente', 'bilang', 'gembel', 'bakal', 'almarhum', 'ente', 'camat']",-16,negative,-1
